hotel_id,city_id,city,hotel_name,user_rating,hotel_url,description,lat,lon
H032,C020,Cassis,"Magnifique Appartement à Cassis,Parking,2 pas du Port",9.5,https://www.booking.com/hotel/fr/magnifique-appartement-cassis-pres-du-port.fr.html,"L’hébergement Magnifique Appartement à Cassis, Parking,2 pas du Port vous accueille à Cassis, à 500 mètres de ce lieu d’intérêt : Plage de la Grande Mer. Il comprend une terrasse, une connexion Wi-Fi gratuite et une réception ouverte 24h/24. Cet appartement possède un parking privé gratuit et se trouve dans une région où vous pourrez pratiquer des activités telles que la randonnée et le vélo.

Cet appartement avec climatisation se compose de 1 chambre, d'un salon, d'une cuisine entièrement équipée avec un réfrigérateur et une machine à café, ainsi que de 1 salle de bains avec une douche et un sèche-cheveux. Des serviettes et du linge de lit sont à votre disposition.

Vous séjournerez à respectivement 19 km et 20 km de ces lieux d’intérêt : Orange Vélodrome et Métro Rond-point du Prado. L'aéroport le plus proche (Aéroport de Marseille Provence) est à 45 km.Les couples apprécient particulièrement l'emplacement de cet établissement. Ils lui donnent la note de9,9pour un séjour à deux.Les distances indiquées dans la description de l'établissement sont calculées avec © OpenStreetMap.",43.216323,5.536496
H033,C020,Cassis,"AQUARIUS IN CASSIS, Chambres d'Hôtes",9.5,https://www.booking.com/hotel/fr/aquarius-in-cassis-chambres-d-hotes.fr.html,"L’établissement AQUARIUS IN CASSIS, Chambres d'Hôtes se situe à Cassis, à 1,2 km de ce lieu d’intérêt : Plage du Bestouan. Il possède une piscine extérieure, un jardin, une terrasse et un parking privé gratuit. Il est installé à respectivement 19 km, 20 km et 21 km de : Métro Rond-point du Prado, Palais des congrès et des expositions Marseille Chanot et Métro La Timone. Cet établissement non-fumeurs se trouve à 19 km de : Orange Vélodrome.

Les hébergements sont dotés d’une machine à café. Vous bénéficierez d’une salle de bains privative avec une douche et des articles de toilette gratuits. Tous les hébergements comportent une connexion Wi-Fi gratuite et certains offrent une vue sur la montagne. Vous profiterez de la climatisation et d'un coffre-fort.

L’établissement AQUARIUS IN CASSIS, Chambres d'Hôtes sert un petit-déjeuner continental ou sans gluten.

Lors de votre séjour, vous pourrez pratiquer diverses activités à Cassis et dans les environs, telles que la randonnée, la pêche et la plongée avec tuba.

Vous séjournerez à respectivement 22 km et 23 km de ces lieux d’intérêt : Métro Castellane et Basilique Notre-Dame de la Garde. L'aéroport le plus proche (Aéroport de Marseille Provence) est à 45 km.Les couples apprécient particulièrement l'emplacement de cet établissement. Ils lui donnent la note de9,4pour un séjour à deux.Les distances indiquées dans la description de l'établissement sont calculées avec © OpenStreetMap.",43.2223547,5.5345386
H030,C020,Cassis,Bestouan - 3 Chambres - Clim - Spacieux,9.5,https://www.booking.com/hotel/fr/le-bestouan.fr.html,"Offrant une vue sur la mer, l’hébergement Bestouan - 3 Chambres - Clim - Spacieux possède une terrasse et un balcon, à environ 20 km de ce lieu d’intérêt : Orange Vélodrome. Cet hébergement avec climatisation est installé à 400 mètres de : Plage du Bestouan. Vous pourrez profiter d'un parking privé disponible sur place et d'une connexion Wi-Fi gratuite.

Cet appartement compte 3 chambres, une cuisine avec un réfrigérateur et un lave-vaisselle, une télévision à écran plat, un coin salon, ainsi que 1 salle de bains comportant une douche. Des serviettes et du linge de lit moyennant des frais supplémentaires.

Vous séjournerez à respectivement 20 km et 21 km de ces lieux d’intérêt : Métro Rond-point du Prado et Palais des congrès et des expositions Marseille Chanot. L'aéroport le plus proche (Aéroport de Marseille Provence) est à 46 km.Les distances indiquées dans la description de l'établissement sont calculées avec © OpenStreetMap.",43.21526358272,5.533033671689
H097,C029,Carcassonne,Chambres d'hotes - Le Magnolia,9.5,https://www.booking.com/hotel/fr/b-amp-b-le-magnolia-carcassonne.fr.html,"L’établissement Chambres d'hotes - Le Magnolia se trouve à Carcassonne, à proximité de ces lieux d’intérêt : Memorial House (Maison des Memoires), Cathédrale Saint-Michel de Carcassonne et Comtal Castle. Il propose une connexion Wi-Fi gratuite, un jardin et une terrasse.

Les hébergements sont dotés d’un coin salon avec une télévision à écran plat, ainsi que d’une salle de bains privative comprenant des articles de toilette gratuits, un sèche-cheveux et une douche. Des serviettes et du linge de lit moyennant des frais supplémentaires.

L'aéroport le plus proche (Aéroport de Carcassonne) est à 4 km.Les couples apprécient particulièrement l'emplacement de cet établissement. Ils lui donnent la note de9,3pour un séjour à deux.Les distances indiquées dans la description de l'établissement sont calculées avec © OpenStreetMap.",43.215548,2.355568
